component,source_status,materialization_readiness,coverage_note,future_data_violation_count,formal_model_changed,trade_decision_changed,active_in_trade_decision,report_changed,portfolio_replay_executed,ready_for_strategy_replay,ready_for_formal,not_live_rule,forward_returns_live_rule_usage
official_ohlcv_full_sweep_20260708,source_ready,ready_for_core_daily_source_ingest,"TWSE+TPEx official rows=11408, scoped common/required rows=1973",0,False,False,False,True,False,False,False,True,False
Layer0 compact active universe,source_ready_for_traded_value_rank,ready_for_core_materialization_from_20260708_turnover,single-day traded_value available; Core must apply compact Layer0 contract and historical buffer rules,0,False,False,False,True,False,False,False,True,False
Layer4 primary80 snapshot,price_source_ready_reference_only,requires_core_layer4_materialization_contract,2026-07-08 EOD prices ready; primary80 membership latest remains Core-side stale until Core refreshes Layer0-Layer4,0,False,False,False,True,False,False,False,True,False
0050 market regime fields,0050_20260708_close_ready,requires_core_historical_window_join,current 0050 close/turnover ready; MA60/20D/40D/BIAS require Core to join historical PIT window,0,False,False,False,True,False,False,False,True,False
00631L fallback/reference,00631L_20260708_close_ready,ready_for_core_reference_price_join,current 00631L OHLCV ready if needed as fallback/reference,0,False,False,False,True,False,False,False,True,False
dynamic80 pool breadth/dispersion,current_day_price_source_ready,requires_core_pool_membership_and_historical_join,daily OHLCV source ready; pool membership latest remains Core-side stale until refreshed,0,False,False,False,True,False,False,False,True,False
exact consensus trigger source variants,current_day_price_source_ready,requires_core_exact_trigger_refresh,Radar provides 2026-07-08 official prices/turnover only; Core computes trigger variants,0,False,False,False,True,False,False,False,True,False
route_support quant score components,current_day_price_source_ready,requires_core_quant_component_refresh,source package does not compute quant score; no strategy decision changed,0,False,False,False,True,False,False,False,True,False
RS20 top3 risk-tiebreak required fields,current_day_price_source_ready,requires_core_rs20_historical_window_join,current day price ready; RS20 requires historical 0050/ticker window in Core,0,False,False,False,True,False,False,False,True,False
