source_id,dataset,source_name,source_url,official_proxy_manual,coverage,source_date_available,effective_date_available,formal_ready,notes
twse_company_suspend_listing,listing_delisting_suspension_master,TWSE terminated listing companies,https://openapi.twse.com.tw/v1/company/suspendListingCsvAndHtml,official,dated delisting rows available; coverage audit required before full formal master,true,true_DelistingDate,partial_event_rows_not_full_master,Accepted for dated TWSE delisting events only.
twse_company_newlisting,listing_delisting_suspension_master,TWSE recent listed companies,https://openapi.twse.com.tw/v1/company/newlisting,official,"recent listing rows only, not complete 2015-latest history",true,true_ListingDate_or_ApprovedListingDate,partial_event_rows_not_full_master,Accepted only for explicitly dated rows in requested window; not used as complete historical listing archive.
tpex_spendi_history,listing_delisting_suspension_master,TPEx historical suspended/resumed trading stocks,https://www.tpex.org.tw/openapi/v1/tpex_spendi_history,official,endpoint returns dated suspension/resumption rows; observed coverage is not full 2015-latest,true,true_DateOfSuspendedTrading_or_DateOfResumedTrading,partial_event_rows_not_full_master,Accepted for dated TPEx suspension/resumption events only.
twse_current_company_profile,listing_delisting_suspension_master,TWSE current listed company profile,https://openapi.twse.com.tw/v1/opendata/t187ap03_L,official_current_snapshot,current snapshot only,true,current only,false,Proxy inventory only; not used to backfill 2015 PIT membership.
tpex_current_company_profile,listing_delisting_suspension_master,TPEx current company profile,https://www.tpex.org.tw/openapi/v1/mopsfin_t187ap03_O,official_current_snapshot,current snapshot only,true,current only,false,Proxy inventory only; not used to backfill 2015 PIT membership.
