component,source_status,materialization_readiness,coverage_note,future_data_violation_count,formal_model_changed,trade_decision_changed,active_in_trade_decision,report_changed,portfolio_replay_executed,ready_for_strategy_replay,ready_for_formal,not_live_rule,forward_returns_live_rule_usage
official_ohlcv_full_sweep_patch,source_ready,ready_for_core_window_materialization_patch,2026-07-03/06/07/08 TWSE+TPEx official EOD rows ready; designed to append after Core latest 2026-07-02,0,False,False,False,True,False,False,False,True,False
official_ohlcv_pit_daily_sample_patch,source_ready,ready_for_core_window_materialization_patch,same official rows can seed PIT daily sample refresh; Core owns sample/materialization contract,0,False,False,False,True,False,False,False,True,False
Layer0 compact active universe,source_ready_for_5D_20D_60D_traded_value_rank,ready_for_core_window_materialization_patch,patch supplies missing 4 trading days; Core must combine with <=2026-07-02 history,0,False,False,False,True,False,False,False,True,False
Layer4 primary80 snapshot,source_ready_for_core_refresh,ready_for_core_window_materialization_patch,source rows ready; Core must recompute Layer0/Layer1/Layer2/Layer4 contracts,0,False,False,False,True,False,False,False,True,False
0050 market regime fields,source_ready_for_20D_40D_60D_ma_bias_window,ready_for_core_window_materialization_patch,0050 rows present for all patch dates; Core must join prior 60D history,0,False,False,False,True,False,False,False,True,False
dynamic80 pool breadth/dispersion,source_ready_for_pool_window_refresh,ready_for_core_window_materialization_patch,common-stock rows ready for patch dates; Core must use current pool membership/history,0,False,False,False,True,False,False,False,True,False
exact consensus trigger,source_ready_for_trigger_refresh,ready_for_core_window_materialization_patch,patch provides latest OHLCV/turnover inputs; Core computes trigger,0,False,False,False,True,False,False,False,True,False
route_support max1 state machine,source_ready_for_state_machine_refresh,ready_for_core_window_materialization_patch,patch provides latest price/turnover inputs; Core computes state machine,0,False,False,False,True,False,False,False,True,False
RS20 top3 risk-tiebreak,source_ready_for_rs20_window_refresh,ready_for_core_window_materialization_patch,patch provides latest ticker/0050 prices; Core joins prior RS20 window,0,False,False,False,True,False,False,False,True,False
