dataset,source_id,source_name,source_path_or_url,source_type,official_proxy_manual,coverage_start,coverage_end,row_count,symbol_count,source_date_available,release_date_available,effective_date_available,formal_ready,partial_ready,diagnostic_only,decision,acceptance_decision,next_programmatic_source,notes
all_listed_liquid_universe_pit_daily,twse_tpex_full_market_daily_candidate,TWSE/TPEx daily full-market trading files,TWSE/TPEx official daily trading APIs/files,official_candidate,official,2015-01-01,2026-latest,,,true,not_required_for_daily_trade_file_if_trade_date_is_source_date,true,false,false,false,blocked_until_acquired,blocked_until_acquired,Bounded downloader for TWSE MI_INDEX/STOCK_DAY/all-market CSV and TPEx daily quotes; add listing/delisting/suspension metadata.,Needed to build all-listed liquid tradable universe; current generated universe cannot be backfilled.
quarterly_fundamentals_pit,mops_quarterly_financials_xbrl_candidate,MOPS quarterly financial statements / XBRL candidate,"MOPS financial statements, XBRL, financial summary endpoints",official_candidate,official,2015-01-01,2026-latest,,,unknown_until_acquired,required_not_acquired,required_not_acquired,false,false,false,blocked,blocked,Probe MOPS/XBRL financial statement endpoints by company/quarter and capture announcement or filing date.,Backtest factor package still marks valuation/fundamentals PIT blocked.
sector_membership_pit,radar_2015_2021_sector_mainline_contract,2015-2021 sector/mainline PIT contract package,outputs/radar_2015_2021_sector_mainline_pit_contract_20260703,contract_blocked,manual_evidence_candidate,2015-01-01,2021-12-31,6,,true_for_partial_rows_only,not_required,true_for_partial_rows_only,false,false,false,blocked,blocked,MOPS annual reports/prospectuses/company formal filings and any official historical industry classification archive.,Current sector/theme maps excluded; 2015-2021 all years blocked.
sector_breadth_pit_daily,sector_breadth_from_membership_and_liquidity_candidate,Derived sector/mainline breadth daily candidate,Derived only after membership and liquid universe are accepted,derived_candidate,derived,,,0,,inherits_underlying_sources,not_required,inherits_underlying_sources,false,false,false,blocked,blocked,Build after all-listed liquidity and PIT sector/mainline membership are accepted.,Cannot be safely derived from current static maps.
quarterly_fundamentals_pit,backtest_factor_2024_2026_valuation_blocked,Backtest factor package 2024-2026 valuation status,data/formal_sources/backtest_factor_2024_2026/readiness.json,readiness_evidence,official_partial_other_factors,2024-01-02,2026-05-26,,7,false_for_valuation,false_for_valuation,false_for_valuation,false,false,false,confirms_quarterly_fundamentals_blocked,confirms_quarterly_fundamentals_blocked,MOPS/XBRL quarterly financial statements with filing/release date.,"Institutional/margin/day-trading are ready for 7 stocks, but valuation/fundamentals PIT remains blocked."
